{
  "id": "ohchr-palestinian-detainee-treatment-2024-07-31",
  "title": "OHCHR documentation of Palestinian detainee treatment",
  "event_date": null,
  "publication_date": "2024-07-31",
  "location": [
    "Israel",
    "Occupied Palestinian Territory"
  ],
  "actors": [
    "Israeli authorities"
  ],
  "affected_population": [
    "Palestinian detainees"
  ],
  "category": "detention",
  "summary": "OHCHR documented consistent accounts of treatment of Palestinian detainees between 7 October 2023 and 30 June 2024.",
  "claim": "OHCHR documented accounts from released Palestinian detainees describing prolonged blindfolding and shackling, deprivation of food and sleep, beatings, stress positions and electric shocks while in Israeli custody.",
  "legal_characterization": "Documented accounts relevant to alleged torture or other ill-treatment; not an adjudication of any individual allegation.",
  "legal_status": "DOCUMENTED_EVIDENCE",
  "evidence_type": [
    "official-report",
    "witness-interview",
    "document",
    "medical-record"
  ],
  "source_organization": "Office of the United Nations High Commissioner for Human Rights",
  "source_title": "Detention in the context of the escalation of hostilities in Gaza (7 October 2023 - 30 June 2024)",
  "source_url": "https://www.ohchr.org/sites/default/files/documents/countries/opt/20240731-Thematic-report-Detention-context-Gaza-hostilities.pdf",
  "source_document_id": "OHCHR-OPT-Detention-Thematic-Report-2024-07-31",
  "source_page": "pp. 11-15, paras. 42-60",
  "source_quote": null,
  "verification_notes": "Verified against the cited sections of the OHCHR thematic report, including its scope and methodology. OHCHR documents accounts and information; this record does not treat every reported incident as an adjudicated finding.",
  "related_records": [
    "ohchr-detention-gaza-hostilities-2024-07-31"
  ],
  "tags": [
    "detainees",
    "israeli-authorities",
    "ohchr",
    "torture"
  ],
  "created_at": "2026-08-16T00:00:00Z",
  "updated_at": "2026-08-16T00:00:00Z"
}
