{
  "id": "un-sg-children-abducted-7-october-2024-06-03",
  "title": "UN verifies abduction of children on 7 October",
  "event_date": null,
  "publication_date": "2024-06-03",
  "location": [
    "Israel",
    "Occupied Palestinian Territory"
  ],
  "actors": [
    "Israeli forces",
    "Hamas and other Palestinian armed groups"
  ],
  "affected_population": [
    "Palestinian children",
    "Israeli children"
  ],
  "category": "hostages",
  "summary": "The report records child abductions during the Hamas-led attack in Israel.",
  "claim": "The United Nations verified the abduction of Israeli children by Hamas and other Palestinian armed groups on 7 October 2023.",
  "legal_characterization": "UN-verified grave-violation evidence attributed to the Secretary-General’s reporting mechanism; not a court judgment.",
  "legal_status": "DOCUMENTED_EVIDENCE",
  "evidence_type": [
    "official-report"
  ],
  "source_organization": "United Nations Secretary-General",
  "source_title": "Children and armed conflict in Israel and the Occupied Palestinian Territory",
  "source_url": "https://docs.un.org/en/S/2024/384",
  "source_document_id": "S/2024/384",
  "source_page": "paras. 20-23",
  "source_quote": null,
  "verification_notes": "Verified against the cited section of the Secretary-General’s dedicated report. Wording preserves the report’s verification posture and does not attribute unverified incidents.",
  "related_records": [
    "un-coi-gaza-child-casualties-2024-06-12"
  ],
  "tags": [
    "children",
    "united-nations",
    "abduction"
  ],
  "created_at": "2026-08-17T00:00:00Z",
  "updated_at": "2026-08-17T00:00:00Z"
}
