{
  "id": "un-coi-gaza-education-system-destruction-2025-05-06",
  "title": "UN Commission finding on destruction of Gaza's education system",
  "event_date": null,
  "publication_date": "2025-05-06",
  "location": ["Gaza Strip"],
  "actors": ["Israeli security forces"],
  "affected_population": ["Palestinian children", "Palestinian students", "education personnel"],
  "category": "civilian-infrastructure",
  "summary": "The Commission assessed damage to schools and universities and the long-term effects on education in Gaza.",
  "claim": "The Commission found that Israeli attacks since October 2023 effectively destroyed Gaza's education system and that deliberate, unnecessary burning and demolition of schools violated international humanitarian law principles.",
  "legal_characterization": "Factual and legal findings by a UN commission of inquiry; not a judicial judgment.",
  "legal_status": "UN_FINDING",
  "evidence_type": ["official-report", "document", "image", "video", "satellite-imagery", "expert-analysis"],
  "source_organization": "United Nations Independent International Commission of Inquiry on the Occupied Palestinian Territory, including East Jerusalem, and Israel",
  "source_title": "Report of the Independent International Commission of Inquiry on the Occupied Palestinian Territory, including East Jerusalem, and Israel",
  "source_url": "https://docs.un.org/en/A/HRC/59/26",
  "source_document_id": "A/HRC/59/26",
  "source_page": "paras. 76-80",
  "source_quote": null,
  "verification_notes": "Verified against paragraphs 76-80 of A/HRC/59/26. The record is limited to the Commission's education-system findings and does not independently infer legal responsibility beyond the report.",
  "related_records": ["un-coi-gaza-child-casualties-2024-06-12", "un-coi-israeli-operations-gaza-2024-06-12"],
  "tags": ["children", "civilian-infrastructure", "gaza", "israeli-forces", "un-commission-of-inquiry"],
  "created_at": "2026-08-16T00:00:00Z",
  "updated_at": "2026-08-16T00:00:00Z"
}
