{
  "id": "un-coi-released-detainees-forced-displacement-2024-09-11",
  "title": "UN Commission finding on displacement of released Gaza detainees",
  "event_date": null,
  "publication_date": "2024-09-11",
  "location": ["Gaza Strip"],
  "actors": ["Israeli security forces"],
  "affected_population": ["released Palestinian detainees", "Palestinian civilians"],
  "category": "displacement",
  "summary": "The Commission assessed restrictions on released detainees returning to northern Gaza and attacks on civilians attempting to return.",
  "claim": "The Commission found that prohibiting released detainees from returning to northern Gaza constituted forced displacement and that attacks on civilians attempting to return to their families amounted to forcible transfer.",
  "legal_characterization": "War-crime and crime-against-humanity findings by a UN commission of inquiry; not a judicial judgment.",
  "legal_status": "UN_FINDING",
  "evidence_type": ["official-report", "witness-interview", "document"],
  "source_organization": "United Nations Independent International Commission of Inquiry on the Occupied Palestinian Territory, including East Jerusalem, and Israel",
  "source_title": "Report of the Independent International Commission of Inquiry on the Occupied Palestinian Territory, including East Jerusalem, and Israel",
  "source_url": "https://docs.un.org/en/A/79/232",
  "source_document_id": "A/79/232",
  "source_page": "para. 110",
  "source_quote": null,
  "verification_notes": "Verified against paragraph 110 of A/79/232. The record preserves the Commission's legal characterization and does not present the finding as a court judgment.",
  "related_records": ["un-coi-forcible-transfer-gaza-2024-06-12", "ohchr-detention-gaza-hostilities-2024-07-31"],
  "tags": ["detainees", "displacement", "forcible-transfer", "gaza", "israeli-forces", "un-commission-of-inquiry"],
  "created_at": "2026-08-16T00:00:00Z",
  "updated_at": "2026-08-16T00:00:00Z"
}
