{
  "id": "un-coi-reproductive-harm-conditions-of-life-2025-03-13",
  "title": "UN Commission finding on reproductive harm and conditions of life in Gaza",
  "event_date": null,
  "publication_date": "2025-03-13",
  "location": ["Gaza Strip"],
  "actors": ["Israeli authorities", "Israeli security forces"],
  "affected_population": ["Palestinian women and girls", "Palestinians in the Gaza Strip"],
  "category": "civilian-infrastructure",
  "summary": "The Commission assessed the physical and mental effects of the collapse of sexual and reproductive health care on Palestinians in Gaza.",
  "claim": "The Commission found that the lack of access to sexual and reproductive health care caused immediate and long-term physical and mental harm and that the underlying acts deliberately inflicted conditions of life calculated to bring about the physical destruction of Palestinians as a group.",
  "legal_characterization": "UN Commission finding identifying crimes against humanity and a category of genocidal acts; not a final judicial determination.",
  "legal_status": "UN_FINDING",
  "evidence_type": ["official-report", "witness-interview", "document", "medical-record", "expert-analysis"],
  "source_organization": "United Nations Independent International Commission of Inquiry on the Occupied Palestinian Territory, including East Jerusalem, and Israel",
  "source_title": "“More than a human can bear”: Israel’s systematic use of sexual, reproductive and other forms of gender-based violence since 7 October 2023",
  "source_url": "https://docs.un.org/en/A/HRC/58/CRP.6",
  "source_document_id": "A/HRC/58/CRP.6",
  "source_page": "para. 219",
  "source_quote": null,
  "verification_notes": "Verified against paragraph 219 of A/HRC/58/CRP.6. The legal characterization is attributed to the Commission and is not presented as an ICJ merits judgment or an independent legal conclusion by the ledger.",
  "related_records": ["un-coi-reproductive-capacity-birth-prevention-2025-03-13", "un-coi-gaza-healthcare-destruction-policy-2024-09-11"],
  "tags": ["gaza", "genocide-convention", "hospitals", "israeli-authorities", "reproductive-violence", "un-commission-of-inquiry"],
  "created_at": "2026-08-16T00:00:00Z",
  "updated_at": "2026-08-16T00:00:00Z"
}
