{
  "id": "un-coi-state-responsibility-genocide-gaza-2025-09-16",
  "title": "UN Commission conclusion on State responsibility for genocide in Gaza",
  "event_date": null,
  "publication_date": "2025-09-16",
  "location": ["Gaza Strip"],
  "actors": ["State of Israel"],
  "affected_population": ["Palestinians in the Gaza Strip"],
  "category": "legal-proceeding",
  "summary": "The Commission stated its conclusion on State responsibility after applying its Genocide Convention analysis to conduct in Gaza.",
  "claim": "The Commission concluded that the State of Israel bears responsibility for failure to prevent genocide, commission of genocide and failure to punish genocide against Palestinians in the Gaza Strip.",
  "legal_characterization": "State-responsibility conclusion by a UN commission of inquiry; not a final merits judgment of the International Court of Justice.",
  "legal_status": "UN_FINDING",
  "evidence_type": ["official-report", "document", "expert-analysis"],
  "source_organization": "United Nations Independent International Commission of Inquiry on the Occupied Palestinian Territory, including East Jerusalem, and Israel",
  "source_title": "Legal analysis of the conduct of Israel in Gaza pursuant to the Convention on the Prevention and Punishment of the Crime of Genocide",
  "source_url": "https://docs.un.org/en/A/HRC/60/CRP.3",
  "source_document_id": "A/HRC/60/CRP.3",
  "source_page": "para. 255",
  "source_quote": null,
  "verification_notes": "Verified against paragraph 255 of A/HRC/60/CRP.3. UN_FINDING is intentionally used because this is the Commission's conclusion, not a final ICJ merits ruling in South Africa v. Israel and not an independent conclusion by this ledger.",
  "related_records": ["un-coi-genocidal-acts-gaza-2025-09-16", "un-coi-genocidal-intent-gaza-2025-09-16", "icj-provisional-measures-2024-01-26"],
  "tags": ["gaza", "genocide-convention", "israeli-authorities", "un-commission-of-inquiry"],
  "created_at": "2026-08-16T00:00:00Z",
  "updated_at": "2026-08-16T00:00:00Z"
}
