{
  "id": "un-coi-medical-personnel-detained-2024-09-11",
  "title": "UN Commission finds medical personnel were detained and mistreated",
  "event_date": null,
  "publication_date": "2024-09-11",
  "location": [
    "Gaza Strip",
    "Israel"
  ],
  "actors": [
    "Israeli security forces"
  ],
  "affected_population": [
    "Palestinians in the Gaza Strip"
  ],
  "category": "detention",
  "summary": "The Commission investigated detention of health-care workers during attacks on Gaza medical facilities.",
  "claim": "The Commission found that Israeli security forces deliberately killed, detained and tortured medical personnel and targeted medical vehicles.",
  "legal_characterization": "Finding of a United Nations commission of inquiry; not a court judgment.",
  "legal_status": "UN_FINDING",
  "evidence_type": [
    "official-report",
    "witness-interview"
  ],
  "source_organization": "United Nations Independent International Commission of Inquiry on the Occupied Palestinian Territory, including East Jerusalem, and Israel",
  "source_title": "Report of the Independent International Commission of Inquiry on the Occupied Palestinian Territory, including East Jerusalem, and Israel",
  "source_url": "https://docs.un.org/en/A/79/232",
  "source_document_id": "A/79/232",
  "source_page": "paras. 90 and 93",
  "source_quote": null,
  "verification_notes": "Verified against the cited paragraphs and attributed only to the Commission. Qualified language is preserved where the Commission could not verify broader claims.",
  "related_records": [
    "un-coi-gaza-healthcare-destruction-policy-2024-09-11"
  ],
  "tags": [
    "un-commission-of-inquiry",
    "gaza",
    "medical-personnel"
  ],
  "created_at": "2026-08-17T00:00:00Z",
  "updated_at": "2026-08-17T00:00:00Z"
}
