{
  "id": "icj-provisional-measures-2024-01-26",
  "title": "ICJ indicates provisional measures in South Africa v. Israel",
  "event_date": "2024-01-26",
  "publication_date": "2024-01-26",
  "location": ["Gaza Strip", "Israel"],
  "actors": ["State of Israel", "Republic of South Africa"],
  "affected_population": ["Palestinians in the Gaza Strip"],
  "category": "legal-proceeding",
  "summary": "The International Court of Justice indicated provisional measures while expressly stating that it was not deciding the merits of South Africa's genocide claims.",
  "claim": "At the provisional-measures stage, the Court found that at least some rights South Africa claimed under the Genocide Convention were plausible and that there was a real and imminent risk of irreparable prejudice; it ordered Israel to take specified measures pending a merits decision.",
  "legal_characterization": "Provisional measures under Article 41 of the ICJ Statute in proceedings under the Genocide Convention; no final determination that genocide occurred.",
  "legal_status": "COURT_INTERIM_FINDING",
  "evidence_type": ["court-order"],
  "source_organization": "International Court of Justice",
  "source_title": "Order of 26 January 2024, Application of the Genocide Convention in the Gaza Strip (South Africa v. Israel)",
  "source_url": "https://www.icj-cij.org/sites/default/files/case-related/192/192-20240126-ord-01-00-en.pdf",
  "source_document_id": "ICJ-General-List-192-Order-2024-01-26",
  "source_page": "pp. 24-26, paras. 54, 61-62; pp. 29-30, para. 86",
  "source_quote": "The Court considers that there is urgency, in the sense that there is a real and imminent risk that irreparable prejudice will be caused",
  "verification_notes": "Verified against the operative order and its jurisdiction, plausibility, prejudice, and operative sections. Paragraph 30 says the Court was not called upon at this stage to establish breaches of Genocide Convention obligations. The record therefore does not state that the Court found genocide, or that the merits have been decided.",
  "related_records": ["icc-warrants-netanyahu-gallant-2024-11-21"],
  "tags": ["genocide-convention", "icj", "provisional-measures", "south-africa-v-israel"],
  "created_at": "2026-08-16T00:00:00Z",
  "updated_at": "2026-08-16T00:00:00Z"
}
