{
  "id": "un-sr-starvation-conditions-life-2024-03-25",
  "title": "Special Rapporteur concludes starvation-related conduct met an underlying genocidal act",
  "event_date": null,
  "publication_date": "2024-03-25",
  "location": [
    "Gaza Strip"
  ],
  "actors": [
    "State of Israel",
    "Israeli forces"
  ],
  "affected_population": [
    "Palestinians in the Gaza Strip"
  ],
  "category": "humanitarian-aid",
  "summary": "The Special Rapporteur evaluated the siege and deprivation of necessities under the Genocide Convention.",
  "claim": "The Special Rapporteur concluded that the nature and scale of the imposed deprivation of food, water, fuel and humanitarian assistance indicated the intentional infliction of conditions of life calculated to bring about the physical destruction of Palestinians as a group.",
  "legal_characterization": "Conclusion of an independent UN Special Rapporteur; not an ICJ merits judgment or a criminal conviction.",
  "legal_status": "UN_FINDING",
  "evidence_type": [
    "official-report",
    "expert-analysis"
  ],
  "source_organization": "Special Rapporteur on the situation of human rights in the Palestinian territories occupied since 1967",
  "source_title": "Anatomy of a Genocide: Report of the Special Rapporteur on the situation of human rights in the Palestinian territories occupied since 1967",
  "source_url": "https://docs.un.org/en/A/HRC/55/73",
  "source_document_id": "A/HRC/55/73",
  "source_page": "para. 93",
  "source_quote": null,
  "verification_notes": "Verified against the cited conclusion and attributed specifically to the Special Rapporteur. The mandate holder’s conclusion is not relabeled as a court judgment.",
  "related_records": [
    "icj-provisional-measures-2024-01-26"
  ],
  "tags": [
    "un-special-procedures",
    "gaza",
    "starvation"
  ],
  "created_at": "2026-08-17T00:00:00Z",
  "updated_at": "2026-08-17T00:00:00Z"
}
