{
  "id": "icj-systemic-discrimination-2024-07-19",
  "title": "ICJ advisory finding on systemic discrimination",
  "event_date": null,
  "publication_date": "2024-07-19",
  "location": [
    "Occupied Palestinian Territory"
  ],
  "actors": [
    "State of Israel"
  ],
  "affected_population": [
    "Palestinian people"
  ],
  "category": "legal-proceeding",
  "summary": "The Court assessed legislation and measures differentiating between settlers and Palestinians in occupied territory.",
  "claim": "The Court concluded that Israel’s legislation and measures imposed and served to maintain a near-complete separation between settler and Palestinian communities in the West Bank and East Jerusalem and constituted a breach of Article 3 of CERD.",
  "legal_characterization": "Final finding in a non-binding ICJ advisory opinion; not a criminal judgment.",
  "legal_status": "COURT_FINAL_FINDING",
  "evidence_type": [
    "advisory-opinion"
  ],
  "source_organization": "International Court of Justice",
  "source_title": "Legal Consequences arising from the Policies and Practices of Israel in the Occupied Palestinian Territory, including East Jerusalem, Advisory Opinion of 19 July 2024",
  "source_url": "https://www.icj-cij.org/sites/default/files/case-related/186/186-20240719-adv-01-00-en.pdf",
  "source_document_id": "ICJ-General-List-186-Advisory-Opinion-2024-07-19",
  "source_page": "pp. 65-71, paras. 180-229",
  "source_quote": "constitute a breach of Article 3 of CERD",
  "verification_notes": "Verified against the cited reasoning and operative clause of the ICJ advisory opinion. COURT_FINAL_FINDING refers to the completed, non-binding advisory disposition; it is not a contentious judgment or a criminal determination. Classification judgment: the Court did not characterize the breach using the narrower label apartheid in its operative conclusion; manual review is requested.",
  "related_records": [
    "icj-advisory-opinion-occupation-2024-07-19"
  ],
  "tags": [
    "advisory-opinion",
    "discrimination",
    "icj",
    "occupation"
  ],
  "created_at": "2026-08-16T00:00:00Z",
  "updated_at": "2026-08-16T00:00:00Z"
}
