{
  "id": "un-coi-children-killed-7-october-2024-06-12",
  "title": "UN Commission finding on children killed on 7 October",
  "event_date": "2023-10-07",
  "publication_date": "2024-06-12",
  "location": [
    "Israel"
  ],
  "actors": [
    "Hamas military wing",
    "other Palestinian armed groups"
  ],
  "affected_population": [
    "children in Israel"
  ],
  "category": "children",
  "summary": "The Commission documented children among those killed during the 7 October attack in Israel.",
  "claim": "The Commission found that Palestinian armed groups killed children during their 7 October 2023 attack in Israel.",
  "legal_characterization": "Factual finding by a UN commission of inquiry; not a judicial judgment or assignment of individual criminal responsibility.",
  "legal_status": "UN_FINDING",
  "evidence_type": [
    "official-report",
    "witness-interview",
    "document",
    "image",
    "video",
    "expert-analysis"
  ],
  "source_organization": "United Nations Independent International Commission of Inquiry on the Occupied Palestinian Territory, including East Jerusalem, and Israel",
  "source_title": "Report of the Independent International Commission of Inquiry on the Occupied Palestinian Territory, including East Jerusalem, and Israel",
  "source_url": "https://docs.un.org/en/A/HRC/56/26",
  "source_document_id": "A/HRC/56/26",
  "source_page": "pp. 6-7, paras. 24-28",
  "source_quote": null,
  "verification_notes": "Verified against the cited paragraphs of A/HRC/56/26 and the Commission methodology in paragraphs 3-7, including its reasonable-grounds standard. This is attributed to the Commission and is not a court judgment or an individual conviction. Classification judgment: the focused factual finding is categorized as children rather than attack-on-civilians; manual review is requested.",
  "related_records": [
    "un-coi-palestinian-armed-groups-2024-06-12"
  ],
  "tags": [
    "7-october",
    "children",
    "hamas",
    "un-commission-of-inquiry"
  ],
  "created_at": "2026-08-16T00:00:00Z",
  "updated_at": "2026-08-16T00:00:00Z"
}
