{
  "id": "un-coi-hostage-mistreatment-2024-09-11",
  "title": "UN Commission finding on intentional mistreatment of hostages",
  "event_date": null,
  "publication_date": "2024-09-11",
  "location": ["Gaza Strip"],
  "actors": ["Hamas", "other Palestinian armed groups"],
  "affected_population": ["Israeli and foreign hostages"],
  "category": "hostages",
  "summary": "The Commission assessed physical and psychological mistreatment of hostages held in Gaza.",
  "claim": "The Commission found that hostages were intentionally mistreated to inflict physical pain and severe mental suffering, including physical violence, sexual violence, forced isolation, deprivation, threats and humiliation.",
  "legal_characterization": "Factual and legal finding by a UN commission of inquiry; not a judicial judgment or individual conviction.",
  "legal_status": "UN_FINDING",
  "evidence_type": ["official-report", "witness-interview", "document", "image", "video", "medical-record"],
  "source_organization": "United Nations Independent International Commission of Inquiry on the Occupied Palestinian Territory, including East Jerusalem, and Israel",
  "source_title": "Report of the Independent International Commission of Inquiry on the Occupied Palestinian Territory, including East Jerusalem, and Israel",
  "source_url": "https://docs.un.org/en/A/79/232",
  "source_document_id": "A/79/232",
  "source_page": "para. 111",
  "source_quote": null,
  "verification_notes": "Verified against paragraph 111 of A/79/232. The record is limited to the Commission's finding about intentional mistreatment and keeps that institutional attribution explicit.",
  "related_records": ["un-coi-hostage-taking-2024-06-12", "ohchr-hostage-treatment-2024-07-31", "un-coi-sexual-violence-hostages-2024-06-12"],
  "tags": ["hamas", "hostages", "ill-treatment", "sexual-violence", "torture", "un-commission-of-inquiry"],
  "created_at": "2026-08-16T00:00:00Z",
  "updated_at": "2026-08-16T00:00:00Z"
}
