{
  "id": "un-coi-genocidal-intent-gaza-2025-09-16",
  "title": "UN Commission finding on genocidal intent in Gaza",
  "event_date": null,
  "publication_date": "2025-09-16",
  "location": ["Gaza Strip"],
  "actors": ["Israeli authorities", "Israeli security forces"],
  "affected_population": ["Palestinians in the Gaza Strip"],
  "category": "legal-proceeding",
  "summary": "The Commission assessed direct statements and the overall pattern of conduct in determining the mens rea element of genocide.",
  "claim": "The Commission concluded that statements by Israeli authorities were direct evidence of genocidal intent and that the total pattern of conduct supported genocidal intent as the only reasonable inference.",
  "legal_characterization": "Mens rea finding by a UN commission of inquiry in its Genocide Convention analysis; not an ICJ merits judgment or final judicial determination.",
  "legal_status": "UN_FINDING",
  "evidence_type": ["official-report", "document", "expert-analysis"],
  "source_organization": "United Nations Independent International Commission of Inquiry on the Occupied Palestinian Territory, including East Jerusalem, and Israel",
  "source_title": "Legal analysis of the conduct of Israel in Gaza pursuant to the Convention on the Prevention and Punishment of the Crime of Genocide",
  "source_url": "https://docs.un.org/en/A/HRC/60/CRP.3",
  "source_document_id": "A/HRC/60/CRP.3",
  "source_page": "para. 254",
  "source_quote": null,
  "verification_notes": "Verified against paragraph 254 of A/HRC/60/CRP.3. The ledger records the Commission's conclusion and uses UN_FINDING to prevent it from being confused with a final judgment of the International Court of Justice.",
  "related_records": ["un-coi-genocidal-acts-gaza-2025-09-16", "un-coi-incitement-genocide-officials-2025-09-16"],
  "tags": ["gaza", "genocide-convention", "israeli-authorities", "israeli-forces", "un-commission-of-inquiry"],
  "created_at": "2026-08-16T00:00:00Z",
  "updated_at": "2026-08-16T00:00:00Z"
}
