{
  "id": "un-coi-cultural-education-self-determination-2025-05-06",
  "title": "UN Commission finding on cultural destruction and self-determination",
  "event_date": null,
  "publication_date": "2025-05-06",
  "location": ["Occupied Palestinian Territory"],
  "actors": ["Israeli authorities", "Israeli security forces", "Israeli settlers"],
  "affected_population": ["Palestinian people"],
  "category": "legal-proceeding",
  "summary": "The Commission assessed the combined effect of attacks on education, cultural and religious sites on Palestinian collective identity and self-determination.",
  "claim": "The Commission concluded on reasonable grounds that destruction of education and cultural and religious sites, restrictions on access and erasure of heterogeneous history violated the Palestinian people's right to self-determination.",
  "legal_characterization": "International-law finding by a UN commission of inquiry; not a judicial judgment.",
  "legal_status": "UN_FINDING",
  "evidence_type": ["official-report", "document", "image", "video", "satellite-imagery", "expert-analysis"],
  "source_organization": "United Nations Independent International Commission of Inquiry on the Occupied Palestinian Territory, including East Jerusalem, and Israel",
  "source_title": "Report of the Independent International Commission of Inquiry on the Occupied Palestinian Territory, including East Jerusalem, and Israel",
  "source_url": "https://docs.un.org/en/A/HRC/59/26",
  "source_document_id": "A/HRC/59/26",
  "source_page": "para. 97",
  "source_quote": null,
  "verification_notes": "Verified against paragraph 97 of A/HRC/59/26. The record preserves the Commission's reasonable-grounds wording and does not present the conclusion as a court judgment or extend it beyond the report's stated scope.",
  "related_records": ["icj-palestinian-self-determination-2024-07-19", "un-coi-gaza-education-system-destruction-2025-05-06"],
  "tags": ["advisory-opinion", "occupation", "self-determination", "un-commission-of-inquiry"],
  "created_at": "2026-08-16T00:00:00Z",
  "updated_at": "2026-08-16T00:00:00Z"
}
