{
  "id": "icj-provisional-measures-reporting-2024-01-26",
  "title": "ICJ orders Israel to report on provisional measures",
  "event_date": "2024-01-26",
  "publication_date": "2024-01-26",
  "location": [
    "Gaza Strip"
  ],
  "actors": [
    "State of Israel"
  ],
  "affected_population": [
    "Palestinians in the Gaza Strip"
  ],
  "category": "legal-proceeding",
  "summary": "The reporting direction forms part of the Court’s interim order and does not decide the merits.",
  "claim": "The Court ordered Israel to submit a report within one month on all measures taken to give effect to the provisional-measures order.",
  "legal_characterization": "Binding procedural component of an ICJ provisional-measures order; no final merits determination.",
  "legal_status": "COURT_INTERIM_FINDING",
  "evidence_type": [
    "court-order"
  ],
  "source_organization": "International Court of Justice",
  "source_title": "Order of 26 January 2024, Application of the Genocide Convention in the Gaza Strip (South Africa v. Israel)",
  "source_url": "https://www.icj-cij.org/sites/default/files/case-related/192/192-20240126-ord-01-00-en.pdf",
  "source_document_id": "ICJ-General-List-192-Order-2024-01-26",
  "source_page": "p. 30, para. 86, operative clause 6",
  "source_quote": null,
  "verification_notes": "Verified against the operative clause. This is a reporting requirement at the provisional-measures stage, not a merits judgment.",
  "related_records": [
    "icj-provisional-measures-2024-01-26"
  ],
  "tags": [
    "icj",
    "provisional-measures",
    "genocide-convention"
  ],
  "created_at": "2026-08-17T00:00:00Z",
  "updated_at": "2026-08-17T00:00:00Z"
}
