{
  "id": "un-coi-incitement-genocide-officials-2025-09-16",
  "title": "UN Commission finding on incitement to genocide by Israeli officials",
  "event_date": null,
  "publication_date": "2025-09-16",
  "location": ["Israel", "Gaza Strip"],
  "actors": ["Isaac Herzog", "Benjamin Netanyahu", "Yoav Gallant", "Israeli authorities"],
  "affected_population": ["Palestinians in the Gaza Strip"],
  "category": "statement",
  "summary": "The Commission assessed statements by senior Israeli political officials as part of its Genocide Convention legal analysis.",
  "claim": "The Commission concluded that President Isaac Herzog, Prime Minister Benjamin Netanyahu and then Defence Minister Yoav Gallant had incited the commission of genocide and that Israeli authorities failed to take action to punish the incitement.",
  "legal_characterization": "Incitement-to-genocide finding by a UN commission of inquiry; not a criminal conviction or judicial judgment against the named individuals.",
  "legal_status": "UN_FINDING",
  "evidence_type": ["official-report", "document", "expert-analysis"],
  "source_organization": "United Nations Independent International Commission of Inquiry on the Occupied Palestinian Territory, including East Jerusalem, and Israel",
  "source_title": "Legal analysis of the conduct of Israel in Gaza pursuant to the Convention on the Prevention and Punishment of the Crime of Genocide",
  "source_url": "https://docs.un.org/en/A/HRC/60/CRP.3",
  "source_document_id": "A/HRC/60/CRP.3",
  "source_page": "para. 253",
  "source_quote": null,
  "verification_notes": "Verified against paragraph 253 of A/HRC/60/CRP.3. The named-person characterization is explicitly a UN Commission finding; the record does not present it as an ICC or domestic criminal conviction or as an ICJ judgment.",
  "related_records": ["un-coi-genocidal-acts-gaza-2025-09-16", "icc-warrants-netanyahu-gallant-2024-11-21"],
  "tags": ["genocide-convention", "israeli-authorities", "statements", "un-commission-of-inquiry"],
  "created_at": "2026-08-16T00:00:00Z",
  "updated_at": "2026-08-16T00:00:00Z"
}
